{
  "schemaVersion": "1.0.0",
  "corpusId": "repository-interviews-v1",
  "candidateId": "auth-stalniy-casl",
  "capabilityFamily": "authorization",
  "catalogStatus": "active",
  "selectionLabels": [
    "readme-only",
    "simple-library-or-helper"
  ],
  "selectionRationaleCodes": [
    "documentation-sparsity",
    "simple-adoption-surface"
  ],
  "calibrationMember": false,
  "calibrationOrdinal": null,
  "artifactProfile": {
    "presentArtifactCount": 1,
    "notFoundSelectionCount": 0,
    "presentArtifactKinds": [
      "readme"
    ]
  }
}
