{
  "schemaVersion": "1.0.0",
  "corpusId": "repository-interviews-v1",
  "candidateId": "webhook-clerk-javascript",
  "capabilityFamily": "webhooks",
  "catalogStatus": "negative-control",
  "selectionLabels": [
    "likely-material-unknown",
    "negative-control",
    "readme-only",
    "simple-library-or-helper"
  ],
  "selectionRationaleCodes": [
    "material-unknown-pressure",
    "negative-control-boundary",
    "documentation-sparsity",
    "simple-adoption-surface"
  ],
  "calibrationMember": false,
  "calibrationOrdinal": null,
  "artifactProfile": {
    "presentArtifactCount": 1,
    "notFoundSelectionCount": 0,
    "presentArtifactKinds": [
      "readme"
    ]
  }
}
