{
  "schemaVersion": "1.0.0",
  "corpusId": "repository-interviews-v1",
  "candidateId": "rate-envoy-ratelimit",
  "capabilityFamily": "rate-limiting",
  "catalogStatus": "active",
  "selectionLabels": [
    "complex-service-or-platform",
    "likely-material-unknown",
    "rich-additional-documentation"
  ],
  "selectionRationaleCodes": [
    "complex-operational-surface",
    "material-unknown-pressure",
    "documentation-richness"
  ],
  "calibrationMember": false,
  "calibrationOrdinal": null,
  "artifactProfile": {
    "presentArtifactCount": 2,
    "notFoundSelectionCount": 0,
    "presentArtifactKinds": [
      "readme",
      "documentation"
    ]
  }
}
