{
  "schemaVersion": "1.0.0",
  "corpusId": "repository-interviews-v1",
  "candidateId": "jobs-temporal-typescript",
  "capabilityFamily": "background-jobs",
  "catalogStatus": "active",
  "selectionLabels": [
    "complex-service-or-platform",
    "likely-material-unknown",
    "readme-only"
  ],
  "selectionRationaleCodes": [
    "complex-operational-surface",
    "material-unknown-pressure",
    "documentation-sparsity"
  ],
  "calibrationMember": false,
  "calibrationOrdinal": null,
  "artifactProfile": {
    "presentArtifactCount": 1,
    "notFoundSelectionCount": 0,
    "presentArtifactKinds": [
      "readme"
    ]
  }
}
